{
  "schema_version": "n5-d5-l2c-external-witness-bundle-1.0",
  "record_kind": "EXTERNALLY_WITNESSED_DESCRIBE_ONLY_CAPSULE",
  "predicate_type": "https://gaoyouyang.github.io/oerf-bishe-dashboard/attestations/n5-d5-l2c-external-witness/v1",
  "run_id": "replace_run_id",
  "issued_at_utc": "2026-07-19T00:00:00Z",
  "expires_at_utc": "2026-07-19T00:10:00Z",
  "subject": {
    "authorization_sha256": "0000000000000000000000000000000000000000000000000000000000000000",
    "replay_plan_sha256": "0000000000000000000000000000000000000000000000000000000000000000",
    "foundation_report_sha256": "0000000000000000000000000000000000000000000000000000000000000000",
    "adapter_entrypoint_sha256": "0000000000000000000000000000000000000000000000000000000000000000",
    "runner_source_sha256": "0000000000000000000000000000000000000000000000000000000000000000",
    "trust_policy_sha256": "0000000000000000000000000000000000000000000000000000000000000000",
    "challenge_commitment_sha256": "0000000000000000000000000000000000000000000000000000000000000000",
    "output_manifest_sha256": "0000000000000000000000000000000000000000000000000000000000000000"
  },
  "host_capability_statement": {
    "scope": "SIGNED_WITNESS_ASSERTION_REQUIRES_EVIDENCE_AND_BACKEND_REVIEW",
    "capabilities": {
      "process_exec_replacement_denied": true,
      "private_input_root_external_mutation_denied": true,
      "durable_nonce_ledger_root_protected": true,
      "output_root_external_mutation_denied": true
    },
    "evidence": [
      {
        "capability_code": "PROCESS_EXEC_REPLACEMENT_DENIED",
        "result": "PASS",
        "artifact_sha256": "0000000000000000000000000000000000000000000000000000000000000000",
        "measurement_tool_sha256": "0000000000000000000000000000000000000000000000000000000000000000",
        "measurement_method": "replace_with_independent_exec_probe",
        "private_artifact_published": false
      },
      {
        "capability_code": "PRIVATE_INPUT_ROOT_EXTERNAL_MUTATION_DENIED",
        "result": "PASS",
        "artifact_sha256": "0000000000000000000000000000000000000000000000000000000000000000",
        "measurement_tool_sha256": "0000000000000000000000000000000000000000000000000000000000000000",
        "measurement_method": "replace_with_external_input_root_probe",
        "private_artifact_published": false
      },
      {
        "capability_code": "DURABLE_NONCE_LEDGER_ROOT_PROTECTED",
        "result": "PASS",
        "artifact_sha256": "0000000000000000000000000000000000000000000000000000000000000000",
        "measurement_tool_sha256": "0000000000000000000000000000000000000000000000000000000000000000",
        "measurement_method": "replace_with_external_ledger_root_probe",
        "private_artifact_published": false
      },
      {
        "capability_code": "OUTPUT_ROOT_EXTERNAL_MUTATION_DENIED",
        "result": "PASS",
        "artifact_sha256": "0000000000000000000000000000000000000000000000000000000000000000",
        "measurement_tool_sha256": "0000000000000000000000000000000000000000000000000000000000000000",
        "measurement_method": "replace_with_external_output_root_probe",
        "private_artifact_published": false
      }
    ]
  },
  "event_chain": {
    "hash_algorithm": "sha256",
    "domain": "OERF:N5-D5:L2-C:EVENT:V1",
    "event_count": 14,
    "final_event_sha256": "0000000000000000000000000000000000000000000000000000000000000000",
    "events": [
      {"sequence": 0, "event_type": "RUN_CREATED", "request_index": null, "operation": null, "monotonic_ns": 100, "payload_sha256": "0000000000000000000000000000000000000000000000000000000000000000", "previous_event_sha256": "0000000000000000000000000000000000000000000000000000000000000000", "event_sha256": "0000000000000000000000000000000000000000000000000000000000000000"},
      {"sequence": 1, "event_type": "HOST_CAPABILITY_CAPTURE_STARTED", "request_index": null, "operation": null, "monotonic_ns": 200, "payload_sha256": "0000000000000000000000000000000000000000000000000000000000000000", "previous_event_sha256": "0000000000000000000000000000000000000000000000000000000000000000", "event_sha256": "0000000000000000000000000000000000000000000000000000000000000000"},
      {"sequence": 2, "event_type": "HOST_CAPABILITY_CAPTURE_FINISHED", "request_index": null, "operation": null, "monotonic_ns": 300, "payload_sha256": "0000000000000000000000000000000000000000000000000000000000000000", "previous_event_sha256": "0000000000000000000000000000000000000000000000000000000000000000", "event_sha256": "0000000000000000000000000000000000000000000000000000000000000000"},
      {"sequence": 3, "event_type": "AUTHORIZATION_BOUND", "request_index": null, "operation": null, "monotonic_ns": 400, "payload_sha256": "0000000000000000000000000000000000000000000000000000000000000000", "previous_event_sha256": "0000000000000000000000000000000000000000000000000000000000000000", "event_sha256": "0000000000000000000000000000000000000000000000000000000000000000"},
      {"sequence": 4, "event_type": "AUTHORIZATION_CONSUMED", "request_index": null, "operation": null, "monotonic_ns": 500, "payload_sha256": "0000000000000000000000000000000000000000000000000000000000000000", "previous_event_sha256": "0000000000000000000000000000000000000000000000000000000000000000", "event_sha256": "0000000000000000000000000000000000000000000000000000000000000000"},
      {"sequence": 5, "event_type": "PROCESS_STARTED", "request_index": null, "operation": null, "monotonic_ns": 600, "payload_sha256": "0000000000000000000000000000000000000000000000000000000000000000", "previous_event_sha256": "0000000000000000000000000000000000000000000000000000000000000000", "event_sha256": "0000000000000000000000000000000000000000000000000000000000000000"},
      {"sequence": 6, "event_type": "DESCRIBE_SENT", "request_index": 1, "operation": "describe", "monotonic_ns": 700, "payload_sha256": "0000000000000000000000000000000000000000000000000000000000000000", "previous_event_sha256": "0000000000000000000000000000000000000000000000000000000000000000", "event_sha256": "0000000000000000000000000000000000000000000000000000000000000000"},
      {"sequence": 7, "event_type": "DESCRIBE_RECEIVED", "request_index": 1, "operation": "describe", "monotonic_ns": 800, "payload_sha256": "0000000000000000000000000000000000000000000000000000000000000000", "previous_event_sha256": "0000000000000000000000000000000000000000000000000000000000000000", "event_sha256": "0000000000000000000000000000000000000000000000000000000000000000"},
      {"sequence": 8, "event_type": "DESCRIBE_SENT", "request_index": 2, "operation": "describe", "monotonic_ns": 900, "payload_sha256": "0000000000000000000000000000000000000000000000000000000000000000", "previous_event_sha256": "0000000000000000000000000000000000000000000000000000000000000000", "event_sha256": "0000000000000000000000000000000000000000000000000000000000000000"},
      {"sequence": 9, "event_type": "DESCRIBE_RECEIVED", "request_index": 2, "operation": "describe", "monotonic_ns": 1000, "payload_sha256": "0000000000000000000000000000000000000000000000000000000000000000", "previous_event_sha256": "0000000000000000000000000000000000000000000000000000000000000000", "event_sha256": "0000000000000000000000000000000000000000000000000000000000000000"},
      {"sequence": 10, "event_type": "PROCESS_EXITED", "request_index": null, "operation": null, "monotonic_ns": 1100, "payload_sha256": "0000000000000000000000000000000000000000000000000000000000000000", "previous_event_sha256": "0000000000000000000000000000000000000000000000000000000000000000", "event_sha256": "0000000000000000000000000000000000000000000000000000000000000000"},
      {"sequence": 11, "event_type": "OUTPUT_BOUND", "request_index": null, "operation": null, "monotonic_ns": 1200, "payload_sha256": "0000000000000000000000000000000000000000000000000000000000000000", "previous_event_sha256": "0000000000000000000000000000000000000000000000000000000000000000", "event_sha256": "0000000000000000000000000000000000000000000000000000000000000000"},
      {"sequence": 12, "event_type": "COST_OBSERVATION_FINALIZED", "request_index": null, "operation": null, "monotonic_ns": 1300, "payload_sha256": "0000000000000000000000000000000000000000000000000000000000000000", "previous_event_sha256": "0000000000000000000000000000000000000000000000000000000000000000", "event_sha256": "0000000000000000000000000000000000000000000000000000000000000000"},
      {"sequence": 13, "event_type": "RUN_SEALED", "request_index": null, "operation": null, "monotonic_ns": 1400, "payload_sha256": "0000000000000000000000000000000000000000000000000000000000000000", "previous_event_sha256": "0000000000000000000000000000000000000000000000000000000000000000", "event_sha256": "0000000000000000000000000000000000000000000000000000000000000000"}
    ]
  },
  "observed_cost": {
    "phase": "DESCRIBE_ONLY",
    "observation_source": "EXTERNAL_OUT_OF_PROCESS",
    "clock_kind": "MONOTONIC",
    "describe_only_wall_time_ns": 1,
    "describe_only_cpu_user_ns": 0,
    "describe_only_cpu_system_ns": 0,
    "describe_only_peak_rss_bytes": null,
    "process_launches": 1,
    "failed_prior_attempts": 0,
    "describe_event_measurement_complete": true,
    "unobserved_processes_possible": false,
    "processes_observed": 1,
    "descendants_observed": 0,
    "external_operation_counts": {
      "describe": 2,
      "forward": 0,
      "jvp": 0,
      "vjp": 0
    },
    "describe_only_adapter_physics_work": {
      "status": "NOT_OBSERVED_IN_DESCRIBE_ONLY_RUN",
      "ray_segments": null,
      "integration_samples": null,
      "kernel_evaluations": null
    },
    "memory_observation_status": "NOT_RELIABLY_OBSERVED",
    "observer_tool_sha256": "0000000000000000000000000000000000000000000000000000000000000000"
  },
  "terminal_status": "DESCRIBE_ONLY_COMPLETE_NO_SCIENCE_AUTHORIZATION",
  "claim_authorizations": {
    "real_bost_interface": false,